{
  "schemaVersion": 1,
  "id": "relic.refund_capacitor",
  "name": "Refund Capacitor",
  "rarity": "uncommon",
  "family": "circuit",
  "modifiers": [{
    "channel": "reaction.potency3.energy_refund",
    "condition": { "event": "primary_reaction_potency_3" },
    "operation": "add",
    "value": 1,
    "priority": 100
  }],
  "triggers": [],
  "unlockId": null,
  "artId": "relic.refund_capacitor"
}
